review_id,clause_id,clause_x,clause_y,pred_bert,pred_tfidf,pred_agg,pred_tfidf_agg,extra
3,4,"Чуть позже перезвонил, ответил оператор Иван, который у меня спросил, каким способом было зачисление на карту, когда я сказал, что это кредит, то он ответил, что переживать не стоит, поскольку средства кредитные","Чуть позже перезвонил, ответил оператор Иван, который у меня спросил, каким способом было зачисление на карту, когда я сказал, что это кредит, то он ответил, что переживать не стоит, поскольку средства кредитные",Потребительский кредит: нейтрально,Потребительский кредит,"{'Автокредит': 'нейтрально', 'Дистанционное обслуживание': 'нейтрально', 'Денежные переводы': 'положительно', 'Потребительский кредит': 'нейтрально', 'Обслуживание': 'отрицательно', 'Дебетовая карта': 'нейтрально'}","['Автокредит', 'Вклады', 'Дебетовая карта', 'Денежные переводы', 'Дистанционное обслуживание', 'Ипотека', 'Кредитная карта', 'Обслуживание', 'Потребительский кредит']","['Вклады', 'Кредитная карта', 'Ипотека']"
3,5,"то банк не будет взымать комиссию за снятие наличных средства В ЛЮБОМ БАНКОМАТЕ СЕТИ, НЕЗАВИСИМО ОТ СУММЫ.","то банк не будет взымать комиссию за снятие наличных средства В ЛЮБОМ БАНКОМАТЕ СЕТИ, НЕЗАВИСИМО ОТ СУММЫ.",—,"Денежные переводы, Потребительский кредит","{'Автокредит': 'нейтрально', 'Дистанционное обслуживание': 'нейтрально', 'Денежные переводы': 'положительно', 'Потребительский кредит': 'нейтрально', 'Обслуживание': 'отрицательно', 'Дебетовая карта': 'нейтрально'}","['Автокредит', 'Вклады', 'Дебетовая карта', 'Денежные переводы', 'Дистанционное обслуживание', 'Ипотека', 'Кредитная карта', 'Обслуживание', 'Потребительский кредит']","['Вклады', 'Кредитная карта', 'Ипотека']"
3,6,"Поверив Ивану, отправляемся с продавцом в ближайший банкомат Газпромбанка, первая попытка оказалась неуспешной, в банкомате не было денег.","Поверив Ивану, отправляемся с продавцом в ближайший банкомат Газпромбанка, первая попытка оказалась неуспешной, в банкомате не было денег.",—,Денежные переводы,"{'Автокредит': 'нейтрально', 'Дистанционное обслуживание': 'нейтрально', 'Денежные переводы': 'положительно', 'Потребительский кредит': 'нейтрально', 'Обслуживание': 'отрицательно', 'Дебетовая карта': 'нейтрально'}","['Автокредит', 'Вклады', 'Дебетовая карта', 'Денежные переводы', 'Дистанционное обслуживание', 'Ипотека', 'Кредитная карта', 'Обслуживание', 'Потребительский кредит']","['Вклады', 'Кредитная карта', 'Ипотека']"
3,7,"Приезжаем в офис на другом конце города, вставляем карту - облом и тут, денег нет.","Приезжаем в офис на другом конце города, вставляем карту - облом и тут, денег нет.",Обслуживание: отрицательно,"Дебетовая карта, Обслуживание","{'Автокредит': 'нейтрально', 'Дистанционное обслуживание': 'нейтрально', 'Денежные переводы': 'положительно', 'Потребительский кредит': 'нейтрально', 'Обслуживание': 'отрицательно', 'Дебетовая карта': 'нейтрально'}","['Автокредит', 'Вклады', 'Дебетовая карта', 'Денежные переводы', 'Дистанционное обслуживание', 'Ипотека', 'Кредитная карта', 'Обслуживание', 'Потребительский кредит']","['Вклады', 'Кредитная карта', 'Ипотека']"
3,8,тут видим на банкомате наклейку о том,тут видим на банкомате наклейку о том,—,"Дебетовая карта, Денежные переводы, Дистанционное обслуживание","{'Автокредит': 'нейтрально', 'Дистанционное обслуживание': 'нейтрально', 'Денежные переводы': 'положительно', 'Потребительский кредит': 'нейтрально', 'Обслуживание': 'отрицательно', 'Дебетовая карта': 'нейтрально'}","['Автокредит', 'Вклады', 'Дебетовая карта', 'Денежные переводы', 'Дистанционное обслуживание', 'Ипотека', 'Кредитная карта', 'Обслуживание', 'Потребительский кредит']","['Вклады', 'Кредитная карта', 'Ипотека']"
3,9,что возможно снятие наличных средств в банкоматах ПАРТНЕРСКОЙ СЕТИ и перечислен список банков.,что возможно снятие наличных средств в банкоматах ПАРТНЕРСКОЙ СЕТИ и перечислен список банков.,Дебетовая карта: нейтрально,"Дебетовая карта, Денежные переводы","{'Автокредит': 'нейтрально', 'Дистанционное обслуживание': 'нейтрально', 'Денежные переводы': 'положительно', 'Потребительский кредит': 'нейтрально', 'Обслуживание': 'отрицательно', 'Дебетовая карта': 'нейтрально'}","['Автокредит', 'Вклады', 'Дебетовая карта', 'Денежные переводы', 'Дистанционное обслуживание', 'Ипотека', 'Кредитная карта', 'Обслуживание', 'Потребительский кредит']","['Вклады', 'Кредитная карта', 'Ипотека']"
3,10,"Вспоминаю, что о бесплатном снятии наличных по сети мне говорил Иван","Вспоминаю, что о бесплатном снятии наличных по сети мне говорил Иван",Денежные переводы: положительно,"Денежные переводы, Кредитная карта","{'Автокредит': 'нейтрально', 'Дистанционное обслуживание': 'нейтрально', 'Денежные переводы': 'положительно', 'Потребительский кредит': 'нейтрально', 'Обслуживание': 'отрицательно', 'Дебетовая карта': 'нейтрально'}","['Автокредит', 'Вклады', 'Дебетовая карта', 'Денежные переводы', 'Дистанционное обслуживание', 'Ипотека', 'Кредитная карта', 'Обслуживание', 'Потребительский кредит']","['Вклады', 'Кредитная карта', 'Ипотека']"
3,11,"как раз в соседнем доме находился офис Райффайзенбанка, логотип которого красовался среди других на банкомате Газпрома, в той самой партнерской сети, выбор пал на него.","как раз в соседнем доме находился офис Райффайзенбанка, логотип которого красовался среди других на банкомате Газпрома, в той самой партнерской сети, выбор пал на него.",—,Денежные переводы,"{'Автокредит': 'нейтрально', 'Дистанционное обслуживание': 'нейтрально', 'Денежные переводы': 'положительно', 'Потребительский кредит': 'нейтрально', 'Обслуживание': 'отрицательно', 'Дебетовая карта': 'нейтрально'}","['Автокредит', 'Вклады', 'Дебетовая карта', 'Денежные переводы', 'Дистанционное обслуживание', 'Ипотека', 'Кредитная карта', 'Обслуживание', 'Потребительский кредит']","['Вклады', 'Кредитная карта', 'Ипотека']"
3,12,"На банкомате Райффайзена также стоит табличка о возможности снятия средств от партнеров сети без комиссии, среди которых был и Газпромбанк.","На банкомате Райффайзена также стоит табличка о возможности снятия средств от партнеров сети без комиссии, среди которых был и Газпромбанк.",Денежные переводы: положительно,"Дебетовая карта, Денежные переводы","{'Автокредит': 'нейтрально', 'Дистанционное обслуживание': 'нейтрально', 'Денежные переводы': 'положительно', 'Потребительский кредит': 'нейтрально', 'Обслуживание': 'отрицательно', 'Дебетовая карта': 'нейтрально'}","['Автокредит', 'Вклады', 'Дебетовая карта', 'Денежные переводы', 'Дистанционное обслуживание', 'Ипотека', 'Кредитная карта', 'Обслуживание', 'Потребительский кредит']","['Вклады', 'Кредитная карта', 'Ипотека']"
3,13,Провели 2 операции снятия 1 на сумму 300 тысяч рублей и вторая на 495 тысяч рубей.,Провели 2 операции снятия 1 на сумму 300 тысяч рублей и вторая на 495 тысяч рубей.,Денежные переводы: нейтрально,"Дебетовая карта, Денежные переводы","{'Автокредит': 'нейтрально', 'Дистанционное обслуживание': 'нейтрально', 'Денежные переводы': 'положительно', 'Потребительский кредит': 'нейтрально', 'Обслуживание': 'отрицательно', 'Дебетовая карта': 'нейтрально'}","['Автокредит', 'Вклады', 'Дебетовая карта', 'Денежные переводы', 'Дистанционное обслуживание', 'Ипотека', 'Кредитная карта', 'Обслуживание', 'Потребительский кредит']","['Вклады', 'Кредитная карта', 'Ипотека']"
3,14,После чего смотрю на телефон и поступают 2 смс о том что было обналичено 302000 и 499950.,После чего смотрю на телефон и поступают 2 смс о том что было обналичено 302000 и 499950.,—,"Денежные переводы, Дистанционное обслуживание","{'Автокредит': 'нейтрально', 'Дистанционное обслуживание': 'нейтрально', 'Денежные переводы': 'положительно', 'Потребительский кредит': 'нейтрально', 'Обслуживание': 'отрицательно', 'Дебетовая карта': 'нейтрально'}","['Автокредит', 'Вклады', 'Дебетовая карта', 'Денежные переводы', 'Дистанционное обслуживание', 'Ипотека', 'Кредитная карта', 'Обслуживание', 'Потребительский кредит']","['Вклады', 'Кредитная карта', 'Ипотека']"
3,15,"Смотря на суммы понимаю, что банк снял комиссию с первой суммы выдачи -2000 рублей, со второй 4950 рублей.","Смотря на суммы понимаю, что банк снял комиссию с первой суммы выдачи -2000 рублей, со второй 4950 рублей.",—,"Денежные переводы, Кредитная карта","{'Автокредит': 'нейтрально', 'Дистанционное обслуживание': 'нейтрально', 'Денежные переводы': 'положительно', 'Потребительский кредит': 'нейтрально', 'Обслуживание': 'отрицательно', 'Дебетовая карта': 'нейтрально'}","['Автокредит', 'Вклады', 'Дебетовая карта', 'Денежные переводы', 'Дистанционное обслуживание', 'Ипотека', 'Кредитная карта', 'Обслуживание', 'Потребительский кредит']","['Вклады', 'Кредитная карта', 'Ипотека']"
3,16,"На экране банкомата не было информации о размере комиссии и о том, что она вообще будет, что, безусловно","На экране банкомата не было информации о размере комиссии и о том, что она вообще будет, что, безусловно",—,Денежные переводы,"{'Автокредит': 'нейтрально', 'Дистанционное обслуживание': 'нейтрально', 'Денежные переводы': 'положительно', 'Потребительский кредит': 'нейтрально', 'Обслуживание': 'отрицательно', 'Дебетовая карта': 'нейтрально'}","['Автокредит', 'Вклады', 'Дебетовая карта', 'Денежные переводы', 'Дистанционное обслуживание', 'Ипотека', 'Кредитная карта', 'Обслуживание', 'Потребительский кредит']","['Вклады', 'Кредитная карта', 'Ипотека']"
3,17,повлияло бы на мое решение о снятии наличных средств.,повлияло бы на мое решение о снятии наличных средств.,—,"Денежные переводы, Потребительский кредит","{'Автокредит': 'нейтрально', 'Дистанционное обслуживание': 'нейтрально', 'Денежные переводы': 'положительно', 'Потребительский кредит': 'нейтрально', 'Обслуживание': 'отрицательно', 'Дебетовая карта': 'нейтрально'}","['Автокредит', 'Вклады', 'Дебетовая карта', 'Денежные переводы', 'Дистанционное обслуживание', 'Ипотека', 'Кредитная карта', 'Обслуживание', 'Потребительский кредит']","['Вклады', 'Кредитная карта', 'Ипотека']"
